{
  "kind": "policy",
  "policy": "binding.overlay-wins",
  "semantics": "OverlayWins",
  "version": 1,
  "source": "GUIDERS-ADR-0031",
  "vectors": [
    {
      "id": "overlay-gesture-wins-on-key",
      "baseline": {
        "bindings": [
          { "key": "toggle_command_palette", "gesture": "Ctrl+Q" }
        ]
      },
      "overlay": {
        "bindings": [
          { "key": "toggle_command_palette", "gesture": "Ctrl+Shift+Q" }
        ]
      },
      "expect": {
        "bindings": {
          "toggle_command_palette": "Ctrl+Shift+Q"
        }
      }
    }
  ]
}
